{
  "formulaId": "CRIT-DEFAULT",
  "version": "1.0.0",
  "scaleMax": 9,
  "directions": {
    "impact": "higher_is_worse",
    "exploitability": "higher_is_worse",
    "exposure": "higher_is_worse",
    "privilegeRequired": "lower_is_worse",
    "detectionDifficulty": "higher_is_worse"
  },
  "ranges": {
    "impact": { "min": 1, "max": 5 },
    "exploitability": { "min": 1, "max": 5 },
    "exposure": { "min": 1, "max": 3 },
    "privilegeRequired": { "min": 0, "max": 2 },
    "detectionDifficulty": { "min": 0, "max": 2 }
  },
  "weights": {
    "impact": 0.35,
    "exploitability": 0.25,
    "exposure": 0.15,
    "privilegeRequired": 0.15,
    "detectionDifficulty": 0.1
  },
  "rounding": "round"
}
